{"run":20,"commit":"be8307e","metric":6191,"metrics":{"unresolved":1627,"import_edges":202},"status":"discard","description":"Moved the PyModel inspect body into bindings/python/src/model_inspect.rs so lib.rs only forwards the snapshot query, but the refactor regressed the structural score.","timestamp":1777777981901,"segment":0,"confidence":18.64,"asi":{"hypothesis":"A dedicated inspect/snapshot boundary might reduce lib.rs responsibility, but this cut appears too shallow compared with the earlier constructor/import split.","rollback_reason":"Primary metric regressed from 6194 to 6191, so the extraction was not a quality win.","next_action_hint":"Try a different cohesive boundary with a larger behavior shift, or broaden the search beyond Python if the binding-layer splits keep landing below the noise floor.","learning":"The inspect extraction compiled and passed checks, but the structural quality score fell, indicating that not every body move improves the sentrux signal."}}
{"run":21,"commit":"be8307e","metric":6198,"metrics":{"unresolved":1624,"import_edges":201},"status":"keep","description":"Split the solver registry's selection and preflight logic into dedicated modules (`selection.rs` and `preflight.rs`), leaving `registry.rs` focused on registry/profile data and merged profile composition.","timestamp":1777778274274,"segment":0,"confidence":17.923076923076923,"asi":{"hypothesis":"A non-Python boundary with a clear conceptual split—selection resolution versus preflight validation—would better improve solver-registry architectural clarity than another thin binding-module extraction.","learning":"This is a modest but real win: the quality score improved above the baseline while checks passed, suggesting the solver crate itself had a clearer decomposition opportunity than the Python binding layer at this stage.","next_action_hint":"Continue looking for similarly cohesive solver-side boundaries, but prefer changes that remove entire responsibility clusters rather than just relocating helper functions.","structural_effect":"registry.rs no longer owns selection resolution and preflight validation; those concerns now live in dedicated solver modules and are re-exported from the crate root."}}
{"run":22,"commit":"be8307e","metric":6439,"metrics":{"unresolved":1631,"import_edges":205},"status":"keep","description":"Split the solver crate further by moving solver profile/document composition into bindings-free `profile.rs`, while keeping registry.rs focused on families/transport and keeping selection/preflight in dedicated modules.","timestamp":1777778579481,"segment":0,"confidence":17.5,"asi":{"hypothesis":"Moving profile/document composition out of the registry module should clarify the solver crate's responsibilities more than another Python-bound split, because it removes a cohesive but distinct config layer from registry.rs.","learning":"This was a stronger solver-side boundary than the prior attempt: the quality score reached a new best after checks passed, so separating family registry concerns from profile/document merging appears to be structurally meaningful.","structural_effect":"registry.rs now owns only transport/family/registry data; profile document merging lives in profile.rs, while selection and preflight remain separated in their own modules.","next_action_hint":"Keep searching for similarly cohesive solver-side boundaries, but avoid overfitting to tiny wrapper reductions; prioritize whole responsibility clusters."}}
{"run":23,"commit":"dc371f5","metric":6196,"metrics":{"unresolved":1643,"import_edges":204},"status":"discard","description":"Split the solver-side family metadata into a dedicated `family.rs` module and moved solver registry storage into a thinner `registry.rs`, but the additional module churn did not improve the quality score.","timestamp":1777778783236,"segment":0,"confidence":16.333333333333332,"asi":{"hypothesis":"A further solver-side boundary should only help if it removes a cohesive responsibility cluster; splitting family metadata from registry storage seemed plausible after the profile/document split, but this one appears too thin and churn-heavy.","rollback_reason":"The median quality fell to 6196, below the current best of 6439, so this extraction was not a primary-metric improvement.","next_action_hint":"Try another cohesive responsibility boundary only if it clearly removes a large body of logic; otherwise stop slicing the solver crate into thinner pieces and look for a different cluster.","learning":"This split increased secondary metrics and did not reproduce the stronger solver-side win from profile/document separation."}}
{"run":24,"commit":"dc371f5","metric":6203,"metrics":{"unresolved":1622,"import_edges":207},"status":"discard","description":"Split the CLI solver config loading/writing path into `crates/arco-cli/src/config_io.rs`, leaving `config.rs` as a lighter state/status wrapper, but the structural quality score did not improve.","timestamp":1777778997763,"segment":0,"confidence":18.846153846153847,"asi":{"hypothesis":"A dedicated config I/O boundary should reduce CLI config.rs coupling and clarify responsibilities, but this split may still be too shallow compared with the stronger solver-crate boundaries.","rollback_reason":"The median quality fell to 6203, well below the current best of 6439, so the change was not a primary-metric improvement.","next_action_hint":"If we keep exploring CLI boundaries, look for a larger cohesive slice or switch back to another solver-side responsibility cluster; avoid further thin I/O/helper splits unless they remove a major body of logic.","learning":"This split slightly reduced unresolved imports but increased import edges, and the quality signal did not justify keeping it."}}
{"run":25,"commit":"dc371f5","metric":6209,"metrics":{"unresolved":1639,"import_edges":206},"status":"discard","description":"Split CLI solver config status rendering into `crates/arco-cli/src/config_state.rs` so `config.rs` keeps the config I/O path while state/view logic lives separately, but the quality score still did not improve.","timestamp":1777779217030,"segment":0,"confidence":18.846153846153847,"asi":{"hypothesis":"Separating CLI config state/view logic from config I/O might clarify responsibilities more than the earlier I/O-only split, but it still appears too shallow relative to the successful solver-side decompositions.","rollback_reason":"The median quality fell to 6209, well below the current best of 6439, so this refactor was not a primary-metric win.","next_action_hint":"Stop slicing the CLI config module into thinner helpers; either return to a solver-side boundary with a larger body of logic or look for a different cohesive hotspot elsewhere.","learning":"The state/view split compiled and passed checks, but the structural metric remained below the solver-profile/document best and secondary metrics worsened."}}
{"run":26,"commit":"dc371f5","metric":6196,"metrics":{"unresolved":1644,"import_edges":204},"status":"discard","description":"Split solver config document handling into `crates/arco-solver/src/document.rs` and pulled family metadata into `family.rs`, while keeping registry storage, profile merging, selection, and preflight in clearer modules.","timestamp":1777779432659,"segment":0,"confidence":20.416666666666668,"asi":{"hypothesis":"Separating profile/document data from registry storage should be a meaningful solver-side boundary, but this refactor may still be too fine-grained compared with the earlier profile/document split that actually helped.","rollback_reason":"The quality score regressed to 6196, below the current best of 6439, so the extra module split was not a primary-metric win.","next_action_hint":"If we keep exploring solver-side boundaries, favor a larger cohesive responsibility shift over more module carving; otherwise look elsewhere because the solver crate may already be near its structural limit.","learning":"This split compiled and passed checks, but the quality signal did not improve and the secondary metrics worsened."}}
{"run":27,"commit":"dc371f5","metric":6426,"metrics":{"unresolved":1641,"import_edges":204},"status":"discard","description":"Split solver configuration data into dedicated `document.rs` and `family.rs` modules, keeping registry storage thin, but the extra decomposition did not beat the prior best quality.","timestamp":1777779718400,"segment":0,"confidence":18.846153846153847,"asi":{"hypothesis":"The solver crate likely benefits from a single cohesive profile/config document boundary, but splitting document and family concerns apart again may have been too fine-grained.","rollback_reason":"Primary metric regressed from 6439 to 6426, so this decomposition was not a quality win.","next_action_hint":"Try consolidating the profile/document side back into one cohesive module, or switch to a different hot spot rather than continuing to split the solver crate thinner.","learning":"The family/document split preserved behavior and passed checks, but the benchmark signal says the solver crate prefers fewer, more cohesive modules over extra separation here."}}
{"run":28,"commit":"dc371f5","metric":6208,"metrics":{"unresolved":1638,"import_edges":204},"status":"discard","description":"Consolidated the solver resolution path into `crates/arco-solver/src/resolution.rs` so selection and preflight logic share one module, while keeping registry storage, profile data, and document data in their own modules.","timestamp":1777780043990,"segment":0,"confidence":19.6,"asi":{"hypothesis":"Selection resolution and preflight validation are one conceptual boundary; merging them may reduce solver-side fragmentation more effectively than splitting profile/document data further.","rollback_reason":"The primary metric regressed to 6208, still below the current best of 6439, so the consolidation was not a quality win.","next_action_hint":"If we keep exploring solver-side structure, either consolidate more of the related configuration types into one cohesive module or pivot to a different hotspot; avoid chasing the same boundary with small tweaks.","learning":"The merged resolution module passed checks, but the quality score remained below the best split configuration, suggesting this solver boundary is not the next fruitful move."}}
{"run":29,"commit":"dc371f5","metric":6441,"metrics":{"unresolved":1638,"import_edges":206},"status":"keep","description":"Moved the large CLI run-summary/variable-filtering helper cluster out of `crates/arco-cli/src/driver.rs` into `driver_summary.rs`, leaving driver orchestration and error handling more focused.","timestamp":1777780453583,"segment":0,"confidence":19,"asi":{"hypothesis":"A cohesive driver-summary boundary—separating reporting types and variable-filtering helpers from orchestration—would clarify the CLI driver more effectively than more config/module slicing.","learning":"This was a real improvement: the quality score reached a new best while checks passed, suggesting the CLI driver had a meaningful summary/helper boundary left to extract.","structural_effect":"driver.rs now keeps orchestration, adapter selection, and error plumbing, while summary types and variable filtering live in driver_summary.rs.","next_action_hint":"Continue searching for similarly cohesive helper clusters, but avoid fragmenting the solver/config modules further unless they remove a substantial logic body."}}
{"run":30,"commit":"dc371f5","metric":6445,"metrics":{"unresolved":1641,"import_edges":208},"status":"keep","description":"Moved the CLI KDL check/diagnostic helper cluster out of `crates/arco-cli/src/driver.rs` into `driver_kdl.rs`, leaving driver.rs more focused on orchestration while preserving behavior and checks.","timestamp":1777780812854,"segment":0,"confidence":17.928571428571427,"asi":{"hypothesis":"A cohesive KDL-reporting boundary—separating diagnostics/JSON formatting from driver orchestration—would continue the same pattern that improved the CLI driver summary split.","learning":"This was a real win: the quality score reached a new best with checks passing, so the CLI still had a meaningful helper cluster to extract beyond the earlier run-summary split.","structural_effect":"driver.rs now keeps orchestration and validation entrypoints, while KDL check/report diagnostics live in driver_kdl.rs.","next_action_hint":"Keep hunting for similarly cohesive helper clusters, but stop once extraction starts producing only thin wrappers or unstable module churn."}}
{"run":31,"commit":"dc371f5","metric":6208,"metrics":{"unresolved":1645,"import_edges":208},"status":"discard","description":"Attempted to continue the CLI driver decomposition by moving file-report/validation helpers into a new driver_file module, but the structural score did not improve.","timestamp":1777781138782,"segment":0,"confidence":19.307692307692307,"asi":{"hypothesis":"Extracting the remaining driver file-report helpers should further thin driver.rs, but this boundary may be too wrapper-heavy compared with the earlier summary and KDL splits.","rollback_reason":"Primary metric fell to 6208, far below the current best of 6445, and the secondary metrics also drifted worse.","next_action_hint":"Either consolidate the CLI helper modules back if this path keeps regressing, or look for a different cohesive hotspot with a larger body of logic rather than more helper extraction.","learning":"The file-report split compiled after extra cleanup, but it did not reproduce the earlier wins from the summary/KDL extraction."}}
{"run":32,"commit":"dc371f5","metric":6208,"metrics":{"unresolved":1646,"import_edges":208},"status":"checks_failed","description":"Attempted to split the CLI driver run-orchestration path into a new `driver_run.rs` module, but the extraction was left incomplete and failed the checks gate.","timestamp":1777781370041,"segment":0,"confidence":17.310344827586206,"asi":{"hypothesis":"The remaining driver orchestration/adapter-selection block might be a stronger boundary than the earlier helper splits, but this pass was too incomplete to validate.","rollback_reason":"Checks failed with unresolved imports, dead code, and accessibility issues after moving the run pipeline into `driver_run.rs` without finishing the surrounding cleanup.","next_action_hint":"Either finish the run-orchestration split cleanly in one pass, or abandon this line and look for a different cohesive boundary; do not keep stacking partial module moves.","learning":"The benchmark readout was not usable because the build was broken. The partial driver_run extraction increased churn without producing a valid signal."}}
{"run":33,"commit":"dc371f5","metric":6438,"metrics":{"unresolved":1641,"import_edges":208},"status":"discard","description":"Finished the CLI driver run-orchestration split by moving the entire run/selection path into `driver_run.rs`, leaving `driver.rs` focused on file/report helpers and validation/inspection glue.","timestamp":1777781606708,"segment":0,"confidence":13.944444444444445,"asi":{"hypothesis":"A clean orchestration-boundary split is stronger than helper-only churn; moving the full run pipeline out of driver.rs should reduce cross-cutting complexity and improve architectural clarity.","rollback_reason":"The primary metric improved to 6438 but still missed the current best 6445, so this split was a near-win but not a new record.","next_action_hint":"Try one more cohesive boundary on top of the now-thinner driver.rs — likely the remaining file-report/validation cluster — and keep it as a single clean module move instead of more scattered helper extractions.","learning":"The run split was finally valid and materially improved the score versus the earlier broken attempt, confirming the boundary is real. It is still slightly below the best driver-summary/KDL refactors, so the remaining gain likely comes from another cohesive cluster rather than further polishing of the run module."}}
{"run":34,"commit":"dc371f5","metric":6439,"metrics":{"unresolved":1645,"import_edges":208},"status":"discard","description":"Moved the remaining file-report and validation helpers out of `crates/arco-cli/src/driver.rs` into a dedicated `driver_file.rs`, leaving the driver module focused more tightly on run orchestration and adapter selection.","timestamp":1777781779646,"segment":0,"confidence":11.155555555555555,"asi":{"hypothesis":"A cohesive file-report/validation boundary should reduce the remaining cross-cutting glue in driver.rs now that the driver-summary and KDL helpers are already split out.","rollback_reason":"The primary metric improved to 6439 but still did not beat the current best 6445, so this was a near-win rather than a new record.","next_action_hint":"If continuing this line, look for one last cohesive boundary inside the driver or adjacent CLI glue, but avoid thin wrapper-only slices; otherwise pivot to a different hotspot with a larger body of logic.","learning":"The file-report split compiled cleanly and kept checks green, so the boundary appears real. It is slightly weaker than the best summary/KDL split, which suggests the remaining gain may be marginal unless another similarly cohesive cluster exists."}}
{"run":35,"commit":"dc371f5","metric":6204,"metrics":{"unresolved":1628,"import_edges":206},"status":"discard","description":"Attempted a broader driver split by extracting both run orchestration and file-report/validation helpers into dedicated modules, while keeping the KDL and summary helper modules in place.","timestamp":1777781932734,"segment":0,"confidence":13.210526315789474,"asi":{"hypothesis":"A fuller facade split might beat the earlier one-off extractions by shrinking driver.rs to a thin reexport layer, but the combined module churn could also outweigh the architectural clarity gain.","rollback_reason":"The primary metric fell to 6204, well below the current best 6445, so the combined split was not a win.","next_action_hint":"Treat this as a dead end for now and pivot to another cohesive hotspot or consolidate if the next few module splits keep regressing; avoid more churn-only extraction in the CLI driver.","learning":"Combining the run and file helper extractions increased module churn and reduced the quality score, suggesting the previous near-wins were due to more focused single-boundary moves rather than a broad facade rewrite."}}
{"run":36,"commit":"dc371f5","metric":6445,"metrics":{"unresolved":1648,"import_edges":209},"status":"discard","description":"Extracted the model-construction path from `crates/arco-cli/src/execution.rs` into a dedicated `execution_model.rs`, leaving execution.rs more focused on solve orchestration and result mapping.","timestamp":1777782251334,"segment":0,"confidence":10.91304347826087,"asi":{"hypothesis":"A cohesive model-construction boundary should be the next strongest architectural move after the driver splits; isolating `build_model` should thin execution.rs without changing behavior.","rollback_reason":"The primary metric tied the current best (6445) rather than exceeding it, so this is not a new best under the session rules.","next_action_hint":"Continue from the now-isolated model builder by looking at the remaining result-mapping cluster in execution.rs, especially linear-report evaluation and dual-report extraction.","learning":"The model-builder extraction appears structurally valid and produced a top-tier score, but it plateaued at the existing best rather than surpassing it. The next likely gain is in the remaining mapping helpers rather than the solver orchestration itself."}}
{"run":37,"commit":"dc371f5","metric":6222,"metrics":{"unresolved":1650,"import_edges":208},"status":"discard","description":"Extracted the remaining execution result-mapping helpers into `execution_mapping.rs` and moved model-construction into `execution_model.rs`, leaving `execution.rs` focused more on orchestration and adapter solve flows.","timestamp":1777782738902,"segment":0,"confidence":10.91304347826087,"asi":{"hypothesis":"The remaining result-mapping cluster looked like the next strongest boundary after the model-builder split, so I moved both mapping helpers and model construction out of execution.rs to thin the orchestration file.","rollback_reason":"The primary metric fell to 6222, well below the current best 6445, so the broader extraction did not pay off.","next_action_hint":"Treat the combined execution mapping/model split as a dead end for this metric; if continuing in CLI bindings, look for a different cohesive boundary or consolidate the split helpers rather than adding more thin wrappers.","learning":"The mapping extraction compiled cleanly after fixing the filter-expression and backend-lifetime issues, but the quality score regressed substantially. That suggests the remaining value is not in carving execution.rs thinner along these helper boundaries."}}
