{"run":61,"commit":"8778e53","metric":7385,"metrics":{"unresolved":1708,"import_edges":206},"status":"keep","description":"refactor: route solver trait status/error imports through solver crate seam","timestamp":1777860512289,"segment":1,"confidence":15.729499467518638,"asi":{"hypothesis":"Eliminating another direct solver_platform->shared_interfaces import edge (traits.rs -> arco-solver-types) via crate reexports should improve architectural quality without behavior change.","structural_effect":"crates/arco-solver/src/traits.rs now imports SolverError and SolverStatus from crate::{...} instead of arco_solver_types directly, removing the remaining sentrux-reported layer_direction violation for traits.rs.","validation":"cargo fmt; cargo check -p arco-solver --tests --no-default-features; autoresearch benchmark+checks passed.","next_action_hint":"Continue dependency-debt paydown by targeting next high-penalty cluster (python lib god-file or solver adapter boundary edges)."}}
{"run":62,"commit":"962257b","metric":7390,"metrics":{"unresolved":1708,"import_edges":206},"status":"keep","description":"refactor: split surface math-block rewrite scanner into focused brace/parsing helpers","timestamp":1777861698392,"segment":1,"confidence":131.96428571428572,"asi":{"hypothesis":"Reducing `rewrite_math_block` cyclomatic complexity through focused scanning helpers should remove another max_cc violation without changing KDL surface normalization behavior.","structural_effect":"Added `find_opening_brace`, `find_matching_brace`, and `rewrite_math_replacement` helpers in `crates/arco-kdl/src/source/surface.rs`, simplifying control flow in `rewrite_math_block`.","validation":"cargo fmt; cargo check -p arco-kdl --tests --no-default-features; targeted surface normalization tests passed; benchmark checks passed.","next_action_hint":"Remaining max_cc hotspot in xpress solver is next straightforward quality gain before tackling larger cross-crate layer/boundary debt."}}
{"run":63,"commit":"HEAD","metric":7398,"metrics":{"unresolved":1710,"import_edges":206},"status":"keep","description":"refactor: decompose xpress solve_model into cohesive helpers to remove max_cc hotspot","timestamp":1777862017041,"segment":1,"confidence":132.10714285714286,"asi":{"hypothesis":"Breaking the high-complexity Xpress solve orchestration into focused preparation/load/optimize/status/extract helpers should remove the final xpress max_cc violation while preserving behavior.","structural_effect":"Added column/row/matrix data builders and helper routines (`load_problem`, `apply_mip_warm_start`, `optimize_problem`, `read_solve_status`, `read_objective_value`, `read_solution_vectors`) and simplified `solve_model` control flow.","validation":"cargo fmt; cargo check -p arco-cli --tests --no-default-features; benchmark checks passed.","next_action_hint":"Only one max_cc hotspot remains (`crates/arco-kdl/src/algebra/tokenizer.rs:tokenize`); tackling that is the cleanest next quality increment before broader layer-violation seam work."}}
{"run":64,"commit":"HEAD","metric":7404,"metrics":{"unresolved":1710,"import_edges":206},"status":"keep","description":"refactor: decompose algebra tokenizer into focused token parsers to clear final max_cc hotspot","timestamp":1777862130183,"segment":1,"confidence":132.21428571428572,"asi":{"hypothesis":"Splitting `tokenize` into specialized parsers (single-char, comparison, string, number, identifier) should remove the remaining max_cc violation while preserving lexical behavior.","structural_effect":"Added `single_char_token_kind`, `parse_comparison_token`, `parse_string_token`, `parse_number_token`, and `parse_identifier_token`; `tokenize` now orchestrates with lower branching complexity.","validation":"cargo fmt; cargo check -p arco-kdl --tests --no-default-features; cargo test -p arco-kdl algebra_parser; benchmark checks passed.","next_action_hint":"Max CC findings are now cleared; next step toward 8k requires tackling high-penalty layer/boundary clusters (python lib god-file and canonical/authoring coupling edges)."}}
{"run":65,"commit":"d446135","metric":7404,"metrics":{"unresolved":1710,"import_edges":206},"status":"keep","description":"refactor: decompose algebra tokenizer into focused token parsers to clear final max_cc hotspot (retry commit)","timestamp":1777862158051,"segment":1,"confidence":162.72527472527472,"asi":{"hypothesis":"Retry same validated tokenizer complexity reduction; only commit-finalization issue previously blocked persistence.","retry_reason":"Previous keep log commit interrupted by typos hook on lowercase hash token in autoresearch metadata.","next_action_hint":"Proceed to next dependency-edge violation cluster after this max_cc cleanup is safely committed."}}
{"run":66,"commit":"17f6088","metric":7407,"metrics":{"unresolved":1710,"import_edges":205},"status":"keep","description":"refactor: route arco-ops request/validation seam away from contracts+validate to local report types","timestamp":1777862568846,"segment":1,"confidence":211.62857142857143,"asi":{"hypothesis":"Reducing operations_facade dependencies on shared_interfaces/validation by using local validation report types and solver-facing request types should improve structural quality.","structural_effect":"`crates/arco-ops/src/lib.rs` now uses local `OpsValidationReport/Issue` and solver-facing request types; removed direct `arco-validate` and `arco-contracts` dependencies from `crates/arco-ops/Cargo.toml`.","validation":"cargo fmt; cargo check -p arco-ops --tests --no-default-features; cargo check -p arco-cli --tests --no-default-features; benchmark checks passed.","tradeoff_note":"sentrux now reports an operations_facade->solver_platform direction violation; despite that, primary quality metric improved and import_edges decreased.","next_action_hint":"Follow-up should resolve the new ops->solver_platform direction issue without reintroducing contracts/validate edges (likely via a lower-layer request type seam)."}}
{"run":67,"commit":"75d46a1","metric":7421,"metrics":{"unresolved":1717,"import_edges":202},"status":"keep","description":"refactor: introduce kdl artifacts seam and reroute compile-type imports away from compile/mod","timestamp":1777862714423,"segment":1,"confidence":224.87878787878788,"asi":{"hypothesis":"A dedicated `arco_kdl::artifacts` seam can remove multiple direct dependencies on `arco-kdl/src/compile/mod.rs` from interaction/exchange/adapter crates, reducing boundary penalties without changing behavior.","structural_effect":"Added `crates/arco-kdl/src/artifacts.rs` with compile artifact re-exports and updated imports in `crates/arco-export/src/lib.rs`, `crates/arco-cli/src/debug_shell.rs` (incl. tests), and `crates/arco-scip/src/lib.rs` (incl. tests) to use artifacts instead of compile/mod.","validation":"cargo fmt; cargo check -p arco-cli --tests --no-default-features; benchmark checks passed.","tradeoff_note":"`crates/arco-ops/src/lib.rs` still has an operations_facade->solver_platform direction violation from prior iteration; this run still improved primary quality materially.","next_action_hint":"Resolve the ops->solver_platform tradeoff next by introducing a lower-layer request type seam so ops can drop solver-platform dependency while keeping prior gains."}}
{"run":68,"commit":"HEAD","metric":7273,"metrics":{"unresolved":1707,"import_edges":206},"status":"discard","description":"refactor: localize arco-ops solve request/selection types to remove solver-platform dependency","timestamp":1777862781037,"segment":1,"confidence":212.02857142857144,"asi":{"hypothesis":"Replacing arco-ops dependency on solver-platform request/selection types with local facade types would remove operations_facade layer violations and improve quality.","rollback_reason":"Primary metric regressed sharply from 7421 to 7273 despite checks passing, indicating this seam change harmed overall structural scoring.","next_action_hint":"Revert this local-type detour and target higher-leverage boundary clusters (python lib god-file or solver adapter canonical-model edges) where prior runs showed positive movement.","learning":"Not all violation removals improve sentrux; this change likely increased other penalties or removed beneficial structure despite cleaner dependency direction."}}
{"run":69,"commit":"HEAD","metric":7273,"metrics":{"unresolved":1710,"import_edges":207},"status":"discard","description":"refactor: shift CLI execution compile-artifact imports to arco_kdl::artifacts seam","timestamp":1777862898773,"segment":1,"confidence":148.42,"asi":{"hypothesis":"Moving remaining CLI compile-type imports to the artifacts seam would reduce compile/mod coupling penalties and raise structural quality.","rollback_reason":"Primary metric regressed heavily from 7421 to 7273 with checks passing, so this seam shift is net negative in current rule weighting.","next_action_hint":"Revert this import-path refactor and focus on higher-leverage dependency-graph work (python god-file/layer violations or solver adapter canonical-model coupling).","learning":"For interaction surfaces, importing authoring-surface artifacts still incurs strong layer-direction penalties and can outweigh boundary improvements."}}
{"run":70,"commit":"796cfd2","metric":7407,"metrics":{"unresolved":1710,"import_edges":205},"status":"keep","description":"refactor: revert kdl artifacts seam and restore direct compile imports for export/scip/debug_shell","timestamp":1777863031585,"segment":1,"confidence":195.28947368421052,"asi":{"hypothesis":"The introduced `arco_kdl::artifacts` seam was over-penalized by current sentrux layer/boundary rules; restoring prior compile imports should recover structural score.","structural_effect":"Restored `arco_kdl::compile` imports in `crates/arco-export/src/lib.rs`, `crates/arco-scip/src/lib.rs` (+tests), and `crates/arco-cli/src/debug_shell.rs` (+tests); removed `crates/arco-kdl/src/artifacts.rs` and its module export.","validation":"cargo fmt; cargo check -p arco-cli --tests --no-default-features; benchmark checks passed.","next_action_hint":"Use this recovered baseline and continue with dependency-debt moves that do not route interaction/exchange/adapter crates through authoring-surface seams."}}
